As-Of-Date,Symbol,Name,CUSIP,ISIN,SEDOL,Percent-Of-Assets,Quantity,Sector,Country,Exchange,Market Currency,Exchange Rate,Currency
10/30/2020,BRK.B,BERKSHIRE HATHAWAY INC CL B COMMON STOCK USD.0033,84670702,US0846707026,2073390,2.5188894,"819,350.00", ,US,,USD,1,USD
10/30/2020,JNJ,JOHNSON + JOHNSON COMMON STOCK USD1.0,478160104,US4781601046,2475833,2.2719227,"1,088,231.00", ,US,,USD,1,USD
10/30/2020,PG,PROCTER + GAMBLE CO/THE COMMON STOCK,742718109,US7427181091,2704407,2.1484484,"1,029,163.00", ,US,,USD,1,USD
10/30/2020,JPM,JPMORGAN CHASE + CO COMMON STOCK USD1.0,46625H100,US46625H1005,2190385,1.8805107,"1,259,706.00", ,US,,USD,1,USD
10/30/2020,VZ,VERIZON COMMUNICATIONS INC COMMON STOCK USD.1,92343V104,US92343V1044,2090571,1.4843792,"1,710,578.00", ,US,,USD,1,USD
10/30/2020,DIS,WALT DISNEY CO/THE COMMON STOCK USD.01,254687106,US2546871060,2270726,1.3790428,"746,952.00", ,US,,USD,1,USD
10/30/2020,PFE,PFIZER INC COMMON STOCK USD.05,717081103,US7170811035,2684703,1.2408308,"2,296,813.00", ,US,,USD,1,USD
10/30/2020,WMT,WALMART INC COMMON STOCK USD.1,931142103,US9311421039,2936921,1.2126517,"573,984.00", ,US,,USD,1,USD
10/30/2020,CMCSA,COMCAST CORP CLASS A COMMON STOCK USD.01,20030N101,US20030N1019,2044545,1.2118907,"1,884,240.00", ,US,,USD,1,USD
10/30/2020,T,AT+T INC COMMON STOCK USD1.0,00206R102,US00206R1023,2831811,1.2116208,"2,944,951.00", ,US,,USD,1,USD
10/30/2020,MRK,MERCK + CO. INC. COMMON STOCK USD.5,58933Y105,US58933Y1055,2778844,1.1971476,"1,045,367.00", ,US,,USD,1,USD
10/30/2020,INTC,INTEL CORP COMMON STOCK USD.001,458140100,US4581401001,2463247,1.1853122,"1,758,012.00", ,US,,USD,1,USD
10/30/2020,ABT,ABBOTT LABORATORIES COMMON STOCK,2824100,US0028241000,2002305,1.1712058,"731,789.00", ,US,,USD,1,USD
10/30/2020,KO,COCA COLA CO/THE COMMON STOCK USD.25,191216100,US1912161007,2206657,1.169315,"1,597,881.00", ,US,,USD,1,USD
10/30/2020,PEP,PEPSICO INC COMMON STOCK USD.017,713448108,US7134481081,2681511,1.161478,"572,282.00", ,US,,USD,1,USD
10/30/2020,BAC,BANK OF AMERICA CORP COMMON STOCK USD.01,60505104,US0605051046,2295677,1.1372459,"3,151,394.00", ,US,,USD,1,USD
10/30/2020,MCD,MCDONALD S CORP COMMON STOCK USD.01,580135101,US5801351017,2550707,0.9975451,"307,574.00", ,US,,USD,1,USD
10/30/2020,CSCO,CISCO SYSTEMS INC COMMON STOCK USD.001,17275R102,US17275R1023,2198163,0.9565682,"1,749,920.00", ,US,,USD,1,USD
10/30/2020,ABBV,ABBVIE INC COMMON STOCK USD.01,00287Y109,US00287Y1091,B92SR70,0.9452517,"729,482.00", ,US,,USD,1,USD
10/30/2020,NKE,NIKE INC  CL B COMMON STOCK,654106103,US6541061031,2640147,0.9408202,"514,556.00", ,US,,USD,1,USD
10/30/2020,NEE,NEXTERA ENERGY INC COMMON STOCK USD.01,65339F101,US65339F1012,2328915,0.9025607,"809,660.00", ,US,,USD,1,USD
10/30/2020,QCOM,QUALCOMM INC COMMON STOCK USD.0001,747525103,US7475251036,2714923,0.876076,"466,406.00", ,US,,USD,1,USD
10/30/2020,ACN,ACCENTURE PLC CL A COMMON STOCK USD.0000225,G1151C101,IE00B4BNMY34,B4BNMY3,0.8685419,"262,971.00", ,IE,,USD,1,USD
10/30/2020,XOM,EXXON MOBIL CORP COMMON STOCK,30231G102,US30231G1022,2326618,0.8681269,"1,747,817.00", ,US,,USD,1,USD
10/30/2020,MDT,MEDTRONIC PLC COMMON STOCK USD.1,G5960L103,IE00BTN1Y115,BTN1Y11,0.85075,"555,559.00", ,IE,,USD,1,USD
10/30/2020,CVX,CHEVRON CORP COMMON STOCK USD.75,166764100,US1667641005,2838555,0.842154,"795,799.00", ,US,,USD,1,USD
10/30/2020,TXN,TEXAS INSTRUMENTS INC COMMON STOCK USD1.0,882508104,US8825081040,2885409,0.8336067,"378,634.00", ,US,,USD,1,USD
10/30/2020,BMY,BRISTOL MYERS SQUIBB CO COMMON STOCK USD.1,110122108,US1101221083,2126335,0.8290923,"931,569.00", ,US,,USD,1,USD
10/30/2020,AMGN,AMGEN INC COMMON STOCK USD.0001,31162100,US0311621009,2023607,0.7997097,"242,097.00", ,US,,USD,1,USD
10/30/2020,UNP,UNION PACIFIC CORP COMMON STOCK USD2.5,907818108,US9078181081,2914734,0.7570517,"280,597.00", ,US,,USD,1,USD
10/30/2020,LOW,LOWE S COS INC COMMON STOCK USD.5,548661107,US5486611073,2536763,0.7520949,"312,419.00", ,US,,USD,1,USD
10/30/2020,HON,HONEYWELL INTERNATIONAL INC COMMON STOCK USD1.0,438516106,US4385161066,2020459,0.7283752,"290,001.00", ,US,,USD,1,USD
10/30/2020,UPS,UNITED PARCEL SERVICE CL B COMMON STOCK USD.01,911312106,US9113121068,2517382,0.6991934,"292,274.00", ,US,,USD,1,USD
10/30/2020,PM,PHILIP MORRIS INTERNATIONAL COMMON STOCK,718172109,US7181721090,B2PKRQ3,0.6960458,"643,656.00", ,US,,USD,1,USD
10/30/2020,ORCL,ORACLE CORP COMMON STOCK USD.01,68389X105,US68389X1054,2661568,0.6827036,"799,077.00", ,US,,USD,1,USD
10/30/2020,LLY,ELI LILLY + CO COMMON STOCK,532457108,US5324571083,2516152,0.6517986,"328,120.00", ,US,,USD,1,USD
10/30/2020,SBUX,STARBUCKS CORP COMMON STOCK USD.001,855244109,US8552441094,2842255,0.6398042,"483,197.00", ,US,,USD,1,USD
10/30/2020,IBM,INTL BUSINESS MACHINES CORP COMMON STOCK USD.2,459200101,US4592001014,2005973,0.6258467,"368,101.00", ,US,,USD,1,USD
10/30/2020,MMM,3M CO COMMON STOCK USD.01,88579Y101,US88579Y1010,2595708,0.5797795,"238,039.00", ,US,,USD,1,USD
10/30/2020,AMD,ADVANCED MICRO DEVICES COMMON STOCK USD.01,7903107,US0079031078,2007849,0.556404,"485,344.00", ,US,,USD,1,USD
10/30/2020,WFC,WELLS FARGO + CO COMMON STOCK USD1.666,949746101,US9497461015,2649100,0.5561579,"1,702,815.00", ,US,,USD,1,USD
10/30/2020,C,CITIGROUP INC COMMON STOCK USD.01,172967424,US1729674242,2297907,0.542693,"860,480.00", ,US,,USD,1,USD
10/30/2020,LMT,LOCKHEED MARTIN CORP COMMON STOCK USD1.0,539830109,US5398301094,2522096,0.5420593,"101,675.00", ,US,,USD,1,USD
10/30/2020,CAT,CATERPILLAR INC COMMON STOCK USD1.0,149123101,US1491231015,2180201,0.5351842,"223,801.00", ,US,,USD,1,USD
10/30/2020,RTX,RAYTHEON TECHNOLOGIES CORP COMMON STOCK USD1.0,7.55E+105,US75513E1010,BM5M5Y3,0.5222643,"631,433.00", ,US,,USD,1,USD
10/30/2020,FIS,FIDELITY NATIONAL INFO SERV COMMON STOCK USD.01,31620M106,US31620M1062,2769796,0.4859039,"256,132.00", ,US,,USD,1,USD
10/30/2020,TGT,TARGET CORP COMMON STOCK USD.0833,8.76E+110,US87612E1064,2259101,0.4796329,"206,935.00", ,US,,USD,1,USD
10/30/2020,MDLZ,MONDELEZ INTERNATIONAL INC A COMMON STOCK,609207105,US6092071058,B8CKK03,0.4776049,"590,483.00", ,US,,USD,1,USD
10/30/2020,CVS,CVS HEALTH CORP COMMON STOCK USD.01,126650100,US1266501006,2577609,0.4618342,"540,751.00", ,US,,USD,1,USD
10/30/2020,PLD,PROLOGIS INC REIT USD.01,74340W103,US74340W1036,B44WZD7,0.4610755,"305,251.00", ,US,,USD,1,USD
10/30/2020,GILD,GILEAD SCIENCES INC COMMON STOCK USD.001,375558103,US3755581036,2369174,0.458841,"518,214.00", ,US,,USD,1,USD
10/30/2020,DE,DEERE + CO COMMON STOCK USD1.0,244199105,US2441991054,2261203,0.4455355,"129,522.00", ,US,,USD,1,USD
10/30/2020,MS,MORGAN STANLEY COMMON STOCK USD.01,617446448,US6174464486,2262314,0.4326906,"590,171.00", ,US,,USD,1,USD
10/30/2020,ANTM,ANTHEM INC COMMON STOCK USD.01,36752103,US0367521038,BSPHGL4,0.4317231,"103,934.00", ,US,,USD,1,USD
10/30/2020,ADP,AUTOMATIC DATA PROCESSING COMMON STOCK USD.1,53015103,US0530151036,2065308,0.4274418,"177,716.00", ,US,,USD,1,USD
10/30/2020,DUK,DUKE ENERGY CORP COMMON STOCK USD.001,26441C204,US26441C2044,B7VD3F2,0.4263376,"303,979.00", ,US,,USD,1,USD
10/30/2020,CL,COLGATE PALMOLIVE CO COMMON STOCK USD1.0,194162103,US1941621039,2209106,0.4255841,"354,291.00", ,US,,USD,1,USD
10/30/2020,D,DOMINION ENERGY INC COMMON STOCK,25746U109,US25746U1097,2542049,0.424782,"347,241.00", ,US,,USD,1,USD
10/30/2020,MO,ALTRIA GROUP INC COMMON STOCK USD.333,02209S103,US02209S1033,2692632,0.4219259,"768,009.00", ,US,,USD,1,USD
10/30/2020,BDX,BECTON DICKINSON AND CO COMMON STOCK USD1.0,75887109,US0758871091,2087807,0.4216084,"119,798.00", ,US,,USD,1,USD
10/30/2020,SYK,STRYKER CORP COMMON STOCK USD.1,863667101,US8636671013,2853688,0.4153856,"135,044.00", ,US,,USD,1,USD
10/30/2020,CCI,CROWN CASTLE INTL CORP REIT USD.01,22822V101,US22822V1017,BTGQCX1,0.4124402,"173,411.00", ,US,,USD,1,USD
10/30/2020,GS,GOLDMAN SACHS GROUP INC COMMON STOCK USD.01,38141G104,US38141G1040,2407966,0.4093572,"142,215.00", ,US,,USD,1,USD
10/30/2020,GE,GENERAL ELECTRIC CO COMMON STOCK USD.06,369604103,US3696041033,2380498,0.4087593,"3,617,932.00", ,US,,USD,1,USD
10/30/2020,FDX,FEDEX CORP COMMON STOCK USD.1,31428X106,US31428X1063,2142784,0.3936468,"99,636.00", ,US,,USD,1,USD
10/30/2020,APD,AIR PRODUCTS + CHEMICALS INC COMMON STOCK USD1.0,9158106,US0091581068,2011602,0.383984,"91,290.00", ,US,,USD,1,USD
10/30/2020,TJX,TJX COMPANIES INC COMMON STOCK USD1.0,872540109,US8725401090,2989301,0.3834214,"495,689.00", ,US,,USD,1,USD
10/30/2020,SCHW,SCHWAB (CHARLES) CORP COMMON STOCK USD.01,808513105,US8085131055,2779397,0.3823576,"610,828.00", ,US,,USD,1,USD
10/30/2020,SO,SOUTHERN CO/THE COMMON STOCK USD5.0,842587107,US8425871071,2829601,0.3818261,"436,488.00", ,US,,USD,1,USD
10/30/2020,CSX,CSX CORP COMMON STOCK USD1.0,126408103,US1264081035,2160753,0.3800677,"316,199.00", ,US,,USD,1,USD
10/30/2020,AXP,AMERICAN EXPRESS CO COMMON STOCK USD.2,25816109,US0258161092,2026082,0.3745822,"269,624.00", ,US,,USD,1,USD
10/30/2020,CB,CHUBB LTD COMMON STOCK,H1467J104,CH0044328745,B3BQMF6,0.3690343,"186,561.00", ,CH,,USD,1,USD
10/30/2020,ATVI,ACTIVISION BLIZZARD INC COMMON STOCK USD.000001,00507V109,US00507V1098,2575818,0.3678668,"319,021.00", ,US,,USD,1,USD
10/30/2020,TFC,TRUIST FINANCIAL CORP COMMON STOCK USD5.0,89832Q109,US89832Q1094,BKP7287,0.3571509,"556,878.00", ,US,,USD,1,USD
10/30/2020,ITW,ILLINOIS TOOL WORKS COMMON STOCK USD.01,452308109,US4523081093,2457552,0.3547551,"118,942.00", ,US,,USD,1,USD
10/30/2020,MU,MICRON TECHNOLOGY INC COMMON STOCK USD.1,595112103,US5951121038,2588184,0.3520593,"459,303.00", ,US,,USD,1,USD
10/30/2020,AMAT,APPLIED MATERIALS INC COMMON STOCK USD.01,38222105,US0382221051,2046552,0.3405082,"377,557.00", ,US,,USD,1,USD
10/30/2020,CME,CME GROUP INC COMMON STOCK USD.01,12572Q105,US12572Q1058,2965839,0.3401651,"148,223.00", ,US,,USD,1,USD
10/30/2020,PGR,PROGRESSIVE CORP COMMON STOCK USD1.0,743315103,US7433151039,2705024,0.3385921,"241,968.00", ,US,,USD,1,USD
10/30/2020,USB,US BANCORP COMMON STOCK USD.01,902973304,US9029733048,2736035,0.3359032,"566,374.00", ,US,,USD,1,USD
10/30/2020,NSC,NORFOLK SOUTHERN CORP COMMON STOCK USD1.0,655844108,US6558441084,2641894,0.3357282,"105,436.00", ,US,,USD,1,USD
10/30/2020,ICE,INTERCONTINENTAL EXCHANGE IN COMMON STOCK USD.01,45866F104,US45866F1049,BFSSDS9,0.3334333,"231,971.00", ,US,,USD,1,USD
10/30/2020,MMC,MARSH + MCLENNAN COS COMMON STOCK USD1.0,571748102,US5717481023,2567741,0.3298427,"209,378.00", ,US,,USD,1,USD
10/30/2020,PNC,PNC FINANCIAL SERVICES GROUP COMMON STOCK USD5.0,693475105,US6934751057,2692665,0.2988697,"175,439.00", ,US,,USD,1,USD
10/30/2020,ECL,ECOLAB INC COMMON STOCK USD1.0,278865100,US2788651006,2304227,0.2868611,"102,617.00", ,US,,USD,1,USD
10/30/2020,KMB,KIMBERLY CLARK CORP COMMON STOCK USD1.25,494368103,US4943681035,2491839,0.2845534,"140,945.00", ,US,,USD,1,USD
10/30/2020,AEP,AMERICAN ELECTRIC POWER COMMON STOCK USD6.5,25537101,US0255371017,2026242,0.2808043,"205,067.00", ,US,,USD,1,USD
10/30/2020,ADI,ANALOG DEVICES INC COMMON STOCK USD.167,32654105,US0326541051,2032067,0.2757335,"152,777.00", ,US,,USD,1,USD
10/30/2020,GM,GENERAL MOTORS CO COMMON STOCK USD.01,37045V100,US37045V1008,B665KZ5,0.2738157,"520,785.00", ,US,,USD,1,USD
10/30/2020,AON,AON PLC CLASS A COMMON STOCK,G0403H108,IE00BLP1HW54,BLP1HW5,0.2683079,"95,761.00", ,US,,USD,1,USD
10/30/2020,WM,WASTE MANAGEMENT INC COMMON STOCK USD.01,94106L109,US94106L1098,2937667,0.2639893,"160,665.00", ,US,,USD,1,USD
10/30/2020,DD,DUPONT DE NEMOURS INC COMMON STOCK USD.01,26614N102,US26614N1028,BK0VN47,0.2627465,"303,371.00", ,US,,USD,1,USD
10/30/2020,ETN,EATON CORP PLC COMMON STOCK USD.01,G29183103,IE00B8KQN827,B8KQN82,0.2614059,"165,408.00", ,US,,USD,1,USD
10/30/2020,BIIB,BIOGEN INC COMMON STOCK USD.0005,09062X103,US09062X1037,2455965,0.2512007,"65,448.00", ,US,,USD,1,USD
10/30/2020,BAX,BAXTER INTERNATIONAL INC COMMON STOCK USD1.0,71813109,US0718131099,2085102,0.2472043,"209,295.00", ,US,,USD,1,USD
10/30/2020,EXC,EXELON CORP COMMON STOCK,30161N101,US30161N1019,2670519,0.244795,"403,028.00", ,US,,USD,1,USD
10/30/2020,DLR,DIGITAL REALTY TRUST INC REIT USD.01,253868103,US2538681030,B03GQS4,0.244366,"111,217.00", ,US,,USD,1,USD
10/30/2020,CTSH,COGNIZANT TECH SOLUTIONS A COMMON STOCK USD.01,192446102,US1924461023,2257019,0.2438674,"224,249.00", ,US,,USD,1,USD
10/30/2020,EMR,EMERSON ELECTRIC CO COMMON STOCK USD.5,291011104,US2910111044,2313405,0.2437899,"247,118.00", ,US,,USD,1,USD
10/30/2020,XEL,XCEL ENERGY INC COMMON STOCK USD2.5,98389B100,US98389B1008,2614807,0.2316676,"217,259.00", ,US,,USD,1,USD
10/30/2020,SRE,SEMPRA ENERGY COMMON STOCK,816851109,US8168511090,2138158,0.228387,"119,649.00", ,US,,USD,1,USD
10/30/2020,GIS,GENERAL MILLS INC COMMON STOCK USD.1,370334104,US3703341046,2367026,0.2274583,"252,676.00", ,US,,USD,1,USD
10/30/2020,PSA,PUBLIC STORAGE REIT USD.1,74460D109,US74460D1090,2852533,0.2189776,"62,781.00", ,US,,USD,1,USD
10/30/2020,EA,ELECTRONIC ARTS INC COMMON STOCK USD.01,285512109,US2855121099,2310194,0.2180239,"119,491.00", ,US,,USD,1,USD
10/30/2020,BX,BLACKSTONE GROUP INC/THE A COMMON STOCK USD.00001,09260D107,US09260D1072,BKF2SL7,0.2129057,"277,320.00", ,US,,USD,1,USD
10/30/2020,DOW,DOW INC COMMON STOCK USD.01,260557103,US2605571031,BHXCF84,0.2123871,"306,626.00", ,US,,USD,1,USD
10/30/2020,APH,AMPHENOL CORP CL A COMMON STOCK USD.001,32095101,US0320951017,2145084,0.2120687,"123,427.00", ,US,,USD,1,USD
10/30/2020,COF,CAPITAL ONE FINANCIAL CORP COMMON STOCK USD.01,14040H105,US14040H1059,2654461,0.2097209,"188,469.00", ,US,,USD,1,USD
10/30/2020,CMI,CUMMINS INC COMMON STOCK USD2.5,231021106,US2310211063,2240202,0.2045838,"61,103.00", ,US,,USD,1,USD
10/30/2020,TEL,TE CONNECTIVITY LTD COMMON STOCK CHF.57,H84989104,CH0102993182,B62B7C3,0.2014338,"136,551.00", ,CH,,USD,1,USD
10/30/2020,WEC,WEC ENERGY GROUP INC COMMON STOCK USD.01,92939U106,US92939U1060,BYY8XK8,0.1998446,"130,529.00", ,US,,USD,1,USD
10/30/2020,TT,TRANE TECHNOLOGIES PLC COMMON STOCK USD1.0,G8994E103,IE00BK9ZQ967,BK9ZQ96,0.199738,"98,815.00", ,IE,,USD,1,USD
10/30/2020,EBAY,EBAY INC COMMON STOCK USD.001,278642103,US2786421030,2293819,0.1994971,"275,076.00", ,US,,USD,1,USD
10/30/2020,A,AGILENT TECHNOLOGIES INC COMMON STOCK USD.01,00846U101,US00846U1016,2520153,0.1983227,"127,581.00", ,US,,USD,1,USD
10/30/2020,JCI,JOHNSON CONTROLS INTERNATION COMMON STOCK USD.01,G51502105,IE00BY7QL619,BY7QL61,0.1975559,"307,377.00", ,US,,USD,1,USD
10/30/2020,COP,CONOCOPHILLIPS COMMON STOCK USD.01,20825C104,US20825C1045,2685717,0.1929345,"442,728.00", ,US,,USD,1,USD
10/30/2020,KLAC,KLA CORP COMMON STOCK USD.001,482480100,US4824801009,2480138,0.192672,"64,173.00", ,US,,USD,1,USD
10/30/2020,PPG,PPG INDUSTRIES INC COMMON STOCK USD1.67,693506107,US6935061076,2698470,0.1924374,"97,427.00", ,US,,USD,1,USD
10/30/2020,TRV,TRAVELERS COS INC/THE COMMON STOCK NPV,8.94E+113,US89417E1091,2769503,0.1922571,"104,601.00", ,US,,USD,1,USD
10/30/2020,GD,GENERAL DYNAMICS CORP COMMON STOCK USD1.0,369550108,US3695501086,2365161,0.1918863,"95,957.00", ,US,,USD,1,USD
10/30/2020,ROST,ROSS STORES INC COMMON STOCK USD.01,778296103,US7782961038,2746711,0.1905813,"146,957.00", ,US,,USD,1,USD
10/30/2020,F,FORD MOTOR CO COMMON STOCK USD.01,345370860,US3453708600,2615468,0.1900348,"1,614,546.00", ,US,,USD,1,USD
10/30/2020,INFO,IHS MARKIT LTD COMMON STOCK USD.01,G47567105,BMG475671050,BD0Q558,0.1896763,"154,036.00", ,GB,,USD,1,USD
10/30/2020,ES,EVERSOURCE ENERGY COMMON STOCK USD5.0,30040W108,US30040W1080,BVVN4Q8,0.1879917,"141,472.00", ,US,,USD,1,USD
10/30/2020,PCAR,PACCAR INC COMMON STOCK USD1.0,693718108,US6937181088,2665861,0.1862449,"143,260.00", ,US,,USD,1,USD
10/30/2020,PEG,PUBLIC SERVICE ENTERPRISE GP COMMON STOCK,744573106,US7445731067,2707677,0.1849375,"208,868.00", ,US,,USD,1,USD
10/30/2020,MET,METLIFE INC COMMON STOCK USD.01,59156R108,US59156R1086,2573209,0.1837182,"318,774.00", ,US,,USD,1,USD
10/30/2020,BLL,BALL CORP COMMON STOCK,58498106,US0584981064,2073022,0.1827851,"134,880.00", ,US,,USD,1,USD
10/30/2020,XLNX,XILINX INC COMMON STOCK USD.01,983919101,US9839191015,2985677,0.1823675,"100,909.00", ,US,,USD,1,USD
10/30/2020,TROW,T ROWE PRICE GROUP INC COMMON STOCK USD.2,74144T108,US74144T1088,2702337,0.180874,"93,785.00", ,US,,USD,1,USD
10/30/2020,YUM,YUM  BRANDS INC COMMON STOCK,988498101,US9884981013,2098876,0.1769298,"124,502.00", ,US,,USD,1,USD
10/30/2020,SYY,SYSCO CORP COMMON STOCK USD1.0,871829107,US8718291078,2868165,0.1768098,"209,942.00", ,US,,USD,1,USD
10/30/2020,BK,BANK OF NEW YORK MELLON CORP COMMON STOCK USD.01,64058100,US0640581007,B1Z77F6,0.1761365,"336,661.00", ,US,,USD,1,USD
10/30/2020,STZ,CONSTELLATION BRANDS INC A COMMON STOCK USD.01,21036P108,US21036P1084,2170473,0.17453,"69,371.00", ,US,,USD,1,USD
10/30/2020,ALL,ALLSTATE CORP COMMON STOCK USD.01,20002101,US0200021014,2019952,0.1743473,"129,016.00", ,US,,USD,1,USD
10/30/2020,ROK,ROCKWELL AUTOMATION INC COMMON STOCK USD1.0,773903109,US7739031091,2754060,0.1728904,"47,885.00", ,US,,USD,1,USD
10/30/2020,AWK,AMERICAN WATER WORKS CO INC COMMON STOCK USD.01,30420103,US0304201033,B2R3PV1,0.171522,"74,843.00", ,US,,USD,1,USD
10/30/2020,CARR,CARRIER GLOBAL CORP COMMON STOCK USD.01,14448C104,US14448C1045,BK4N0D7,0.1710822,"336,500.00", ,US,,USD,1,USD
10/30/2020,AIG,AMERICAN INTERNATIONAL GROUP COMMON STOCK USD2.5,26874784,US0268747849,2027342,0.1707388,"356,087.00", ,US,,USD,1,USD
10/30/2020,,SSC GOVERNMENT MM GVMXX,7839989D1,,,0.1698625,"10,419,916.02", ,US,,USD,16,USD
10/30/2020,MSI,MOTOROLA SOLUTIONS INC COMMON STOCK USD.01,620076307,US6200763075,B5BKPQ4,0.1689179,"70,186.00", ,US,,USD,1,USD
10/30/2020,PH,PARKER HANNIFIN CORP COMMON STOCK USD.5,701094104,US7010941042,2671501,0.1684977,"53,110.00", ,US,,USD,1,USD
10/30/2020,SWK,STANLEY BLACK + DECKER INC COMMON STOCK USD2.5,854502101,US8545021011,B3Q2FJ4,0.1668871,"65,946.00", ,US,,USD,1,USD
10/30/2020,MCHP,MICROCHIP TECHNOLOGY INC COMMON STOCK USD.001,595017104,US5950171042,2592174,0.1668301,"104,268.00", ,US,,USD,1,USD
10/30/2020,PAYX,PAYCHEX INC COMMON STOCK USD.01,704326107,US7043261079,2674458,0.1657875,"132,377.00", ,US,,USD,1,USD
10/30/2020,ED,CONSOLIDATED EDISON INC COMMON STOCK USD.1,209115104,US2091151041,2216850,0.1651213,"138,161.00", ,US,,USD,1,USD
10/30/2020,CLX,CLOROX COMPANY COMMON STOCK USD1.0,189054109,US1890541097,2204026,0.16458,"52,153.00", ,US,,USD,1,USD
10/30/2020,APTV,APTIV PLC COMMON STOCK USD.01,G6095L109,JE00B783TY65,B783TY6,0.1639425,"111,585.00", ,IE,,USD,1,USD
10/30/2020,ADM,ARCHER DANIELS MIDLAND CO COMMON STOCK,39483102,US0394831020,2047317,0.1616931,"229,652.00", ,US,,USD,1,USD
10/30/2020,BBY,BEST BUY CO INC COMMON STOCK USD.1,86516101,US0865161014,2094670,0.1616524,"95,172.00", ,US,,USD,1,USD
10/30/2020,PRU,PRUDENTIAL FINANCIAL INC COMMON STOCK USD.01,744320102,US7443201022,2819118,0.1590994,"163,211.00", ,US,,USD,1,USD
10/30/2020,FCX,FREEPORT MCMORAN INC COMMON STOCK USD.1,35671D857,US35671D8570,2352118,0.1585529,"600,512.00", ,US,,USD,1,USD
10/30/2020,KR,KROGER CO COMMON STOCK USD1.0,501044101,US5010441013,2497406,0.1576372,"321,414.00", ,US,,USD,1,USD
10/30/2020,MRVL,MARVELL TECHNOLOGY GROUP LTD COMMON STOCK USD.002,G5876H105,BMG5876H1051,2594653,0.156935,"274,770.00", ,US,,USD,1,USD
10/30/2020,OTIS,OTIS WORLDWIDE CORP COMMON STOCK USD.01,68902V107,US68902V1070,BK531S8,0.1568995,"168,151.00", ,US,,USD,1,USD
10/30/2020,FAST,FASTENAL CO COMMON STOCK USD.01,311900104,US3119001044,2332262,0.1560459,"237,063.00", ,US,,USD,1,USD
10/30/2020,MAR,MARRIOTT INTERNATIONAL  CL A COMMON STOCK USD.01,571903202,US5719032022,2210614,0.1554527,"109,919.00", ,US,,USD,1,USD
10/30/2020,CTVA,CORTEVA INC COMMON STOCK USD.01,22052L104,US22052L1044,BK73B42,0.1553439,"309,343.00", ,US,,USD,1,USD
10/30/2020,HPQ,HP INC COMMON STOCK USD.01,40434L105,US40434L1052,BYX4D52,0.1551926,"567,494.00", ,US,,USD,1,USD
10/30/2020,WBA,WALGREENS BOOTS ALLIANCE INC COMMON STOCK USD.01,931427108,US9314271084,BTN1Y44,0.1540569,"297,227.00", ,US,,USD,1,USD
10/30/2020,HLT,HILTON WORLDWIDE HOLDINGS IN COMMON STOCK USD.01,43300A203,US43300A2033,BYVMW06,0.1532953,"114,652.00", ,US,,USD,1,USD
10/30/2020,GLW,CORNING INC COMMON STOCK USD.5,219350105,US2193501051,2224701,0.1530181,"314,338.00", ,US,,USD,1,USD
10/30/2020,MCK,MCKESSON CORP COMMON STOCK USD.01,58155Q103,US58155Q1031,2378534,0.1505117,"67,020.00", ,US,,USD,1,USD
10/30/2020,DTE,DTE ENERGY COMPANY COMMON STOCK,233331107,US2333311072,2280220,0.1495973,"79,604.00", ,US,,USD,1,USD
10/30/2020,SWKS,SKYWORKS SOLUTIONS INC COMMON STOCK USD.25,83088M102,US83088M1027,2961053,0.1485799,"69,063.00", ,US,,USD,1,USD
10/30/2020,WLTW,WILLIS TOWERS WATSON PLC COMMON STOCK USD.000304635,G96629103,IE00BDB6Q211,BDB6Q21,0.1478857,"53,224.00", ,GB,,USD,1,USD
10/30/2020,LUV,SOUTHWEST AIRLINES CO COMMON STOCK USD1.0,844741108,US8447411088,2831543,0.1467404,"243,792.00", ,US,,USD,1,USD
10/30/2020,WMB,WILLIAMS COS INC COMMON STOCK USD1.0,969457100,US9694571004,2967181,0.1465824,"501,653.00", ,US,,USD,1,USD
10/30/2020,KMI,KINDER MORGAN INC COMMON STOCK USD.01,49456B101,US49456B1017,B3NQ4P8,0.1457434,"804,338.00", ,US,,USD,1,USD
10/30/2020,AME,AMETEK INC COMMON STOCK USD.01,31100100,US0311001004,2089212,0.141925,"94,917.00", ,US,,USD,1,USD
10/30/2020,AFL,AFLAC INC COMMON STOCK USD.1,1055102,US0010551028,2026361,0.1416766,"274,066.00", ,US,,USD,1,USD
10/30/2020,WELL,WELLTOWER INC REIT USD1.0,95040Q104,US95040Q1040,BYVYHH4,0.1412211,"172,487.00", ,US,,USD,1,USD
10/30/2020,MKC,MCCORMICK + CO NON VTG SHRS COMMON STOCK,579780206,US5797802064,2550161,0.1407233,"51,199.00", ,US,,USD,1,USD
10/30/2020,DHI,DR HORTON INC COMMON STOCK USD.01,23331A109,US23331A1097,2250687,0.1391317,"136,767.00", ,US,,USD,1,USD
10/30/2020,CHD,CHURCH + DWIGHT CO INC COMMON STOCK USD1.0,171340102,US1713401024,2195841,0.1375947,"102,234.00", ,US,,USD,1,USD
10/30/2020,FRC,FIRST REPUBLIC BANK/CA COMMON STOCK USD.01,33616C100,US33616C1009,B4WHY15,0.1366298,"71,136.00", ,US,,USD,1,USD
10/30/2020,VFC,VF CORP COMMON STOCK,918204108,US9182041080,2928683,0.1351521,"132,084.00", ,US,,USD,1,USD
10/30/2020,CERN,CERNER CORP COMMON STOCK USD.01,156782104,US1567821046,2185284,0.1347201,"126,233.00", ,US,,USD,1,USD
10/30/2020,EIX,EDISON INTERNATIONAL COMMON STOCK,281020107,US2810201077,2829515,0.1333971,"156,331.00", ,US,,USD,1,USD
10/30/2020,PPL,PPL CORP COMMON STOCK USD.01,69351T106,US69351T1060,2680905,0.1330445,"317,732.00", ,US,,USD,1,USD
10/30/2020,1RVSZ0,E-MINI RUSS 1000 VDEC20 XCME 20201218,,,,0.1309755,"6,750.00", ,US,,USD,1,USD
10/30/2020,STT,STATE STREET CORP COMMON STOCK USD1.0,857477103,US8574771031,2842040,0.1307317,"145,768.00", ,US,,USD,1,USD
10/30/2020,FTV,FORTIVE CORP COMMON STOCK USD.01,34959J108,US34959J1088,BYT3MK1,0.1306999,"139,345.00", ,US,,USD,1,USD
10/30/2020,SLB,SCHLUMBERGER LTD COMMON STOCK USD.01,806857108,AN8068571086,2779201,0.1305563,"573,910.00", ,US,,USD,1,USD
10/30/2020,PSX,PHILLIPS 66 COMMON STOCK,718546104,US7185461040,B78C4Y8,0.128291,"180,571.00", ,US,,USD,1,USD
10/30/2020,WY,WEYERHAEUSER CO REIT USD1.25,962166104,US9621661043,2958936,0.1282168,"308,559.00", ,US,,USD,1,USD
10/30/2020,ETR,ENTERGY CORP COMMON STOCK USD.01,29364G103,US29364G1031,2317087,0.1275852,"82,781.00", ,US,,USD,1,USD
10/30/2020,HSY,HERSHEY CO/THE COMMON STOCK USD1.0,427866108,US4278661081,2422806,0.127563,"60,946.00", ,US,,USD,1,USD
10/30/2020,MRNA,MODERNA INC COMMON STOCK USD.0001,60770K107,US60770K1079,BGSXTS3,0.1273839,"123,994.00", ,US,,USD,1,USD
10/30/2020,AEE,AMEREN CORPORATION COMMON STOCK USD.01,23608102,US0236081024,2050832,0.1261863,"102,160.00", ,US,,USD,1,USD
10/30/2020,O,REALTY INCOME CORP REIT USD1.0,756109104,US7561091049,2724193,0.125716,"142,695.00", ,US,,USD,1,USD
10/30/2020,EOG,EOG RESOURCES INC COMMON STOCK USD.01,26875P101,US26875P1012,2318024,0.1255579,"240,828.00", ,US,,USD,1,USD
10/30/2020,DFS,DISCOVER FINANCIAL SERVICES COMMON STOCK USD.01,254709108,US2547091080,B1YLC43,0.1255111,"126,794.00", ,US,,USD,1,USD
10/30/2020,AJG,ARTHUR J GALLAGHER + CO COMMON STOCK USD1.0,363576109,US3635761097,2359506,0.1250467,"79,186.00", ,US,,USD,1,USD
10/30/2020,KHC,KRAFT HEINZ CO/THE COMMON STOCK USD.01,500754106,US5007541064,BYRY499,0.1247975,"267,931.00", ,US,,USD,1,USD
10/30/2020,KEYS,KEYSIGHT TECHNOLOGIES IN COMMON STOCK,49338L103,US49338L1035,BQZJ0Q9,0.1235663,"77,383.00", ,US,,USD,1,USD
10/30/2020,AVB,AVALONBAY COMMUNITIES INC REIT USD.01,53484101,US0534841012,2131179,0.1233251,"58,214.00", ,US,,USD,1,USD
10/30/2020,DAL,DELTA AIR LINES INC COMMON STOCK USD.0001,247361702,US2473617023,B1W9D46,0.1230686,"263,788.00", ,US,,USD,1,USD
10/30/2020,LH,LABORATORY CRP OF AMER HLDGS COMMON STOCK USD.1,50540R409,US50540R4092,2586122,0.1224972,"40,271.00", ,US,,USD,1,USD
10/30/2020,AMP,AMERIPRISE FINANCIAL INC COMMON STOCK USD.01,03076C106,US03076C1062,B0J7D57,0.121884,"49,771.00", ,US,,USD,1,USD
10/30/2020,LEN,LENNAR CORP A COMMON STOCK USD.1,526057104,US5260571048,2511920,0.1214146,"113,539.00", ,US,,USD,1,USD
10/30/2020,VRSN,VERISIGN INC COMMON STOCK USD.001,9.23E+106,US92343E1029,2142922,0.1213695,"41,798.00", ,US,,USD,1,USD
10/30/2020,SPG,SIMON PROPERTY GROUP INC REIT USD.0001,828806109,US8288061091,2812452,0.1210036,"126,522.00", ,US,,USD,1,USD
10/30/2020,MPC,MARATHON PETROLEUM CORP COMMON STOCK USD.01,56585A102,US56585A1025,B3K3L40,0.1208973,"269,148.00", ,US,,USD,1,USD
10/30/2020,VMC,VULCAN MATERIALS CO COMMON STOCK USD1.0,929160109,US9291601097,2931205,0.1208572,"54,800.00", ,US,,USD,1,USD
10/30/2020,KKR,KKR + CO INC COMMON STOCK,48251W104,US48251W1045,BG1FRR1,0.1202755,"231,304.00", ,US,,USD,1,USD
10/30/2020,MXIM,MAXIM INTEGRATED PRODUCTS COMMON STOCK USD.001,57772K101,US57772K1016,2573760,0.1170861,"110,403.00", ,US,,USD,1,USD
10/30/2020,RSG,REPUBLIC SERVICES INC COMMON STOCK USD.01,760759100,US7607591002,2262530,0.1167156,"86,937.00", ,US,,USD,1,USD
10/30/2020,CMS,CMS ENERGY CORP COMMON STOCK USD.01,125896100,US1258961002,2219224,0.1141733,"118,400.00", ,US,,USD,1,USD
10/30/2020,HOLX,HOLOGIC INC COMMON STOCK USD.01,436440101,US4364401012,2433530,0.1122474,"107,117.00", ,US,,USD,1,USD
